<?xml version="1.0" encoding="UTF-8"?>
<?xml-stylesheet type="text/xsl" href="formulaire.xsl"?>

<!DOCTYPE formulaire SYSTEM "DTD.dtd">

<formulaire>

    <boutonGroupe id="c1" type="String">
        <label>Fruit</label>
        <checkBox>Pomme</checkBox>
        <checkBox>Poire</checkBox>
        <checkBox>Fraise</checkBox>
    </boutonGroupe>
    
    <liste id="c2" type="String">
        <label>Pays</label>
        <element>France</element>
        <element>Antigua Barbuda</element>
    </liste>
    
    <composant id="c3" compo="champDeTexte" type="String">
        <label>Prénom</label>
    </composant>

    <boutonGroupe id="c4" type="String">
        <label>Sexe</label>
        <boutonRadio>Homme</boutonRadio>
        <boutonRadio>Femme</boutonRadio>
        <boutonRadio>Autre</boutonRadio>
    </boutonGroupe>

    <tableau id="c5" type="int">
        <label>Tableau</label>
        <nbLignes>5</nbLignes>
        <nbColonnes>5</nbColonnes>
    </tableau>

    <calendrier id="c6">
        <label>Calendrier</label>
    </calendrier>

    <composant id="c7" compo="caseACocher" type="boolean">
        <label>Rester connecté ?</label>
    </composant>
    
</formulaire>
